{
  "expected": {
    "report_path": "versioning_unknown.expected.json",
    "sha256": "edffc023fb6b413a09daf2d278bf2c0856c04bdb2cc8cbefc34840c7e9e8efa8"
  },
  "fixture_id": "versioning_unknown",
  "fixture_schema": "nostr_automerge.fixture.v1",
  "inputs": [
    {
      "media_type": "application/json",
      "name": "signed_scenario",
      "path": "versioning_unknown.input.json",
      "sha256": "e68d9def8e540e045ea74655fe1e67c6b88c1c375b0924d6ca902ef6282021d9"
    }
  ],
  "provenance": {
    "created_at": "2026-08-10",
    "generator": "nostr_automerge_conformance generate_signed_profile versioning",
    "generator_revision": "signed_scenario_v2",
    "source_versions": {
      "nostr_automerge": "0.1.0-alpha.0"
    }
  },
  "requirements": [
    "NCRDT-CONF-002",
    "NCRDT-VERSION-001"
  ],
  "revision": "draft_2026_08",
  "seed": null
}