{
  "expected": {
    "report_path": "unrelated_checkpoint_does_not_change_target.expected.json",
    "sha256": "462df18fbaeef3b3f1507c8d11d62c9822d71a88b6545e0f5b6beb9946b8c54e"
  },
  "fixture_id": "unrelated_checkpoint_does_not_change_target",
  "fixture_schema": "nostr_automerge.fixture.v1",
  "inputs": [
    {
      "media_type": "application/json",
      "name": "signed_scenario",
      "path": "unrelated_checkpoint_does_not_change_target.input.json",
      "sha256": "b2c911ff7deda45ba4d7d7d5dac13601cf3a9bdbdb4782b8a538d63b4ab596ac"
    }
  ],
  "provenance": {
    "created_at": "2026-08-10",
    "generator": "nostr_automerge_conformance generate_signed_profile remediation_v4",
    "generator_revision": "signed_scenario_v2",
    "source_versions": {
      "nostr_automerge": "0.1.0-alpha.0"
    }
  },
  "requirements": [
    "NCRDT-CONF-005",
    "NCRDT-SCOPE-002"
  ],
  "revision": "draft_2026_08",
  "seed": null
}