{
  "expected": {
    "report_path": "target_preparation_exact_budget.expected.json",
    "sha256": "4eb1338365d357d5a7f3045302056f8c72d1e81c3105783f24ced7e43b255ccf"
  },
  "fixture_id": "target_preparation_exact_budget",
  "fixture_schema": "nostr_automerge.fixture.v1",
  "inputs": [
    {
      "media_type": "application/json",
      "name": "signed_scenario",
      "path": "target_preparation_exact_budget.input.json",
      "sha256": "45459924830abac1da89f52720d9a9ef129cd3ad669139e17f3530f13a429ddf"
    }
  ],
  "provenance": {
    "created_at": "2026-08-10",
    "generator": "nostr_automerge_conformance generate_signed_profile resource",
    "generator_revision": "signed_scenario_v2",
    "source_versions": {
      "nostr_automerge": "0.1.0-alpha.0"
    }
  },
  "requirements": [
    "NCRDT-CONF-010",
    "NCRDT-RESOURCE-014"
  ],
  "revision": "draft_2026_08",
  "seed": null
}