{
  "expected": {
    "report_path": "child_change_depends_on_pruned_parent_change.expected.json",
    "sha256": "439a14d175faa315672eca20d1b4dc04995e1e9f071fae32e9be0f2afac38e0c"
  },
  "fixture_id": "child_change_depends_on_pruned_parent_change",
  "fixture_schema": "nostr_automerge.fixture.v1",
  "inputs": [
    {
      "media_type": "application/json",
      "name": "signed_scenario",
      "path": "child_change_depends_on_pruned_parent_change.input.json",
      "sha256": "fec3618f9a9c1de39c8768c1c03b1fa98c08df6d3e19f16255565a511416c203"
    }
  ],
  "provenance": {
    "created_at": "2026-08-10",
    "generator": "nostr_automerge_conformance generate_signed_profile remediation_v4",
    "generator_revision": "signed_scenario_v2",
    "source_versions": {
      "nostr_automerge": "0.1.0-alpha.0"
    }
  },
  "requirements": [
    "NCRDT-CONF-005",
    "NCRDT-EPOCH-001"
  ],
  "revision": "draft_2026_08",
  "seed": null
}