{
  "expected": {
    "report_path": "change_with_missing_control.expected.json",
    "sha256": "4c05f88b7bc98fcf4483389b40ab8c8849feb7b741f957e35878e04b9ac318cc"
  },
  "fixture_id": "change_with_missing_control",
  "fixture_schema": "nostr_automerge.fixture.v1",
  "inputs": [
    {
      "media_type": "application/json",
      "name": "signed_scenario",
      "path": "change_with_missing_control.input.json",
      "sha256": "bd4bd4c276183c75e5f24637c47d752d8c873772a132a61c309853a9b633ebbd"
    }
  ],
  "provenance": {
    "created_at": "2026-08-10",
    "generator": "nostr_automerge_conformance generate_signed_profile remediation_v4",
    "generator_revision": "signed_scenario_v2",
    "source_versions": {
      "nostr_automerge": "0.1.0-alpha.0"
    }
  },
  "requirements": [
    "NCRDT-CONF-005",
    "NCRDT-DISPOSITION-002",
    "NCRDT-DUP-002"
  ],
  "revision": "draft_2026_08",
  "seed": null
}