{
  "expected": {
    "report_path": "interrupted_cancel_at_ingress.expected.json",
    "sha256": "6560786cfb1e02ef55cd1706b31cdedafc7a244c990f386b72228be57688f36b"
  },
  "fixture_id": "interrupted_cancel_at_ingress",
  "fixture_schema": "nostr_automerge.fixture.v1",
  "inputs": [
    {
      "media_type": "application/json",
      "name": "signed_scenario",
      "path": "interrupted_cancel_at_ingress.input.json",
      "sha256": "e0f96e8b447921e721fed136cee6ea612f1f54287c67055ddbedb2ab9221ff0f"
    }
  ],
  "provenance": {
    "created_at": "2026-08-10",
    "generator": "nostr_automerge_conformance generate_signed_profile interrupted",
    "generator_revision": "signed_scenario_v2",
    "source_versions": {
      "nostr_automerge": "0.1.0-alpha.0"
    }
  },
  "requirements": [
    "NCRDT-COMPLETION-001",
    "NCRDT-CONF-002",
    "NCRDT-RESOURCE-001"
  ],
  "revision": "draft_2026_08",
  "seed": null
}