{
  "expected": {
    "report_path": "projection_object_key.expected.json",
    "sha256": "09a3681f7b1af70dfaf615770527b2e6064fed8ad1f0566ce557b4d7c73d6618"
  },
  "fixture_id": "projection_object_key",
  "fixture_schema": "nostr_automerge.fixture.v1",
  "inputs": [
    {
      "media_type": "application/json",
      "name": "signed_scenario",
      "path": "projection_object_key.input.json",
      "sha256": "17d01123ebeeb1befad158dda001ea5db3d16a1d2f8aa9caa4c9aac8bc852d5d"
    }
  ],
  "provenance": {
    "created_at": "2026-08-10",
    "generator": "nostr_automerge_conformance generate_signed_profile projection",
    "generator_revision": "signed_scenario_v2",
    "source_versions": {
      "nostr_automerge": "0.1.0-alpha.0"
    }
  },
  "requirements": [
    "NCRDT-CONF-002",
    "NCRDT-STATE-002"
  ],
  "revision": "draft_2026_08",
  "seed": null
}