{
  "expected": {
    "report_path": "change_references_unsupported_control.expected.json",
    "sha256": "eeea434cb92c389b55def4deb39911ab765e41ea62c5e49189588814198e0db1"
  },
  "fixture_id": "change_references_unsupported_control",
  "fixture_schema": "nostr_automerge.fixture.v1",
  "inputs": [
    {
      "media_type": "application/json",
      "name": "signed_scenario",
      "path": "change_references_unsupported_control.input.json",
      "sha256": "ece2d4f62d1e59b60e96e644c2f11af29eb3684c9ea60fce2a3a693073dd1c3a"
    }
  ],
  "provenance": {
    "created_at": "2026-08-10",
    "generator": "nostr_automerge_conformance generate_signed_profile remediation_v6_change_references_unsupported_control",
    "generator_revision": "signed_scenario_v2",
    "source_versions": {
      "nostr_automerge": "0.1.0-alpha.0"
    }
  },
  "requirements": [
    "NCRDT-CONF-005",
    "NCRDT-DISPOSITION-002",
    "NCRDT-VERSION-001"
  ],
  "revision": "draft_2026_08",
  "seed": null
}