{
  "expected": {
    "report_path": "dependencies_base_omission.expected.json",
    "sha256": "ebaa008ce023d7265535fd2a433f8620b2aaab43aab0fb1eeaea5e480c4e3033"
  },
  "fixture_id": "dependencies_base_omission",
  "fixture_schema": "nostr_automerge.fixture.v1",
  "inputs": [
    {
      "media_type": "application/json",
      "name": "signed_scenario",
      "path": "dependencies_base_omission.input.json",
      "sha256": "92c38014f9301b354b784f5c9524dfe678dd4f667f082b0952dc14c5ac44bbc0"
    }
  ],
  "provenance": {
    "created_at": "2026-08-10",
    "generator": "nostr_automerge_conformance generate_signed_profile dependencies",
    "generator_revision": "signed_scenario_v2",
    "source_versions": {
      "nostr_automerge": "0.1.0-alpha.0"
    }
  },
  "requirements": [
    "NCRDT-CONF-002",
    "NCRDT-SEQ-001",
    "NCRDT-STATE-001"
  ],
  "revision": "draft_2026_08",
  "seed": null
}