{
  "expected": {
    "report_path": "post_epoch_semantic_stop_has_no_target_work.expected.json",
    "sha256": "1e057cec79c6d03333bff6f5f37a7a4ebf7bdb189553ec4b95d52d06640b0383"
  },
  "fixture_id": "post_epoch_semantic_stop_has_no_target_work",
  "fixture_schema": "nostr_automerge.fixture.v1",
  "inputs": [
    {
      "media_type": "application/json",
      "name": "signed_scenario",
      "path": "post_epoch_semantic_stop_has_no_target_work.input.json",
      "sha256": "2552c65932927701091248e2f70a4a6c48e7ab803213140c65ac75dc3a8f9549"
    }
  ],
  "provenance": {
    "created_at": "2026-08-10",
    "generator": "nostr_automerge_conformance generate_signed_profile epoch_semantics_v13",
    "generator_revision": "signed_scenario_v2",
    "source_versions": {
      "nostr_automerge": "0.1.0-alpha.0"
    }
  },
  "requirements": [
    "NCRDT-COMPLETION-001",
    "NCRDT-RESOURCE-017"
  ],
  "revision": "draft_2026_08",
  "seed": null
}