{
  "expected": {
    "report_path": "parent_propagation_exact_budget.expected.json",
    "sha256": "0d411cab81f0155ced3803e4d931e3d7a4e88316a981f3295e21fca4f9bccaec"
  },
  "fixture_id": "parent_propagation_exact_budget",
  "fixture_schema": "nostr_automerge.fixture.v1",
  "inputs": [
    {
      "media_type": "application/json",
      "name": "signed_scenario",
      "path": "parent_propagation_exact_budget.input.json",
      "sha256": "5e3fddc80d96ae01c023553689190a1f95f204952d0fdecd26c6047e42e529c9"
    }
  ],
  "provenance": {
    "created_at": "2026-08-10",
    "generator": "nostr_automerge_conformance generate_signed_profile remediation_v7_resource",
    "generator_revision": "signed_scenario_v2",
    "source_versions": {
      "nostr_automerge": "0.1.0-alpha.0"
    }
  },
  "requirements": [
    "NCRDT-CONF-008",
    "NCRDT-RESOURCE-009"
  ],
  "revision": "draft_2026_08",
  "seed": null
}