{
  "expected": {
    "report_path": "tags_change_unknown.expected.json",
    "sha256": "26c75c216a26b262ca89c896260b290bdc1e0f62ebf586800eecc62f403a8d37"
  },
  "fixture_id": "tags_change_unknown",
  "fixture_schema": "nostr_automerge.fixture.v1",
  "inputs": [
    {
      "media_type": "application/json",
      "name": "signed_scenario",
      "path": "tags_change_unknown.input.json",
      "sha256": "c63b93cd9c88250db2767aa9dfc41da74e2fcd2828114d00a68f38f222b19a40"
    }
  ],
  "provenance": {
    "created_at": "2026-08-10",
    "generator": "nostr_automerge_conformance generate_signed_profile tags",
    "generator_revision": "signed_scenario_v2",
    "source_versions": {
      "nostr_automerge": "0.1.0-alpha.0"
    }
  },
  "requirements": [
    "NCRDT-CONF-002",
    "NCRDT-TAG-001"
  ],
  "revision": "draft_2026_08",
  "seed": null
}