{
  "expected": {
    "report_path": "manifest_unknown_tag.expected.json",
    "sha256": "60484001bd0f1b74aa9dfddf246e0d458948e2a73cd969e43a1eccda0a9bc6fc"
  },
  "fixture_id": "manifest_unknown_tag",
  "fixture_schema": "nostr_automerge.fixture.v1",
  "inputs": [
    {
      "media_type": "application/json",
      "name": "signed_scenario",
      "path": "manifest_unknown_tag.input.json",
      "sha256": "cb47ec6e17209c39244a150c98662dd38f7cca733bac1f228dedbfad4b6e1146"
    }
  ],
  "provenance": {
    "created_at": "2026-08-10",
    "generator": "nostr_automerge_conformance generate_signed_profile manifest",
    "generator_revision": "signed_scenario_v2",
    "source_versions": {
      "nostr_automerge": "0.1.0-alpha.0"
    }
  },
  "requirements": [
    "NCRDT-CONF-001",
    "NCRDT-MANIFEST-001"
  ],
  "revision": "draft_2026_08",
  "seed": null
}