{"expected":{"report_path":"epoch_writer_authorization_exact_budget.expected.json","sha256":"c2bc6b4e9c806a02dbeec539c20ac069886b2afdbb24d918c36cd2e6a39bc0ae"},"fixture_id":"epoch_writer_authorization_exact_budget","fixture_schema":"nostr_automerge.fixture.v1","inputs":[{"media_type":"application/json","name":"signed_scenario","path":"epoch_writer_authorization_exact_budget.input.json","sha256":"be9e0d2b5540c9f04fe29f2b15614d203e9b7158f473f8d1a81f7e873beee9ee"}],"provenance":{"created_at":"2026-08-10","generator":"nostr_automerge distribution-v15 budget rebinding","generator_revision":"signed_scenario_v2","source_versions":{"nostr_automerge":"0.1.0-alpha.0"}},"requirements":["NCRDT-RESOURCE-017"],"revision":"draft_2026_08","seed":null}
