{
  "expected": {
    "report_path": "equivocation_descendants.expected.json",
    "sha256": "472cfbb022dbc13889d8c4594ba93abfa63a8c541599130f384e31f48b604ca2"
  },
  "fixture_id": "equivocation_descendants",
  "fixture_schema": "nostr_automerge.fixture.v1",
  "inputs": [
    {
      "media_type": "application/json",
      "name": "signed_scenario",
      "path": "equivocation_descendants.input.json",
      "sha256": "4c2859ff49e1a5468825bf71c495b3b4bddd9beb3b45ee808e74714bb2e59784"
    }
  ],
  "provenance": {
    "created_at": "2026-08-10",
    "generator": "nostr_automerge_conformance generate_signed_profile equivocation",
    "generator_revision": "signed_scenario_v2",
    "source_versions": {
      "nostr_automerge": "0.1.0-alpha.0"
    }
  },
  "requirements": [
    "NCRDT-CONF-002",
    "NCRDT-EQUIV-001"
  ],
  "revision": "draft_2026_08",
  "seed": null
}