{
  "expected": {
    "report_path": "checkpoints_empty_history.expected.json",
    "sha256": "23f5932ca7281c49c63bd2cd5cf2dc47453960eb900a5090a19c0cfc1a67e4db"
  },
  "fixture_id": "checkpoints_empty_history",
  "fixture_schema": "nostr_automerge.fixture.v1",
  "inputs": [
    {
      "media_type": "application/json",
      "name": "signed_scenario",
      "path": "checkpoints_empty_history.input.json",
      "sha256": "4a7d32e0a93ae956017175e0dc5e1235cef8d43ede62c2c00c324ccac4807c6c"
    }
  ],
  "provenance": {
    "created_at": "2026-08-10",
    "generator": "nostr_automerge_conformance generate_signed_profile checkpoints",
    "generator_revision": "signed_scenario_v2",
    "source_versions": {
      "nostr_automerge": "0.1.0-alpha.0"
    }
  },
  "requirements": [
    "NCRDT-CHECKPOINT-001",
    "NCRDT-CONF-002",
    "NCRDT-CPTRUST-001",
    "NCRDT-DISPOSITION-001",
    "NCRDT-OUTCOME-001"
  ],
  "revision": "draft_2026_08",
  "seed": null
}