{
  "expected": {
    "report_path": "projection_mark_none.expected.json",
    "sha256": "cc1d2a178a410b9c30a7f7dc87a03ce3fd5af677a49d93ed86ddd15e7aaff833"
  },
  "fixture_id": "projection_mark_none",
  "fixture_schema": "nostr_automerge.fixture.v1",
  "inputs": [
    {
      "media_type": "application/json",
      "name": "signed_scenario",
      "path": "projection_mark_none.input.json",
      "sha256": "f7f75d8b13e32b0d1401a9b2838ad34f40f22b51df3387f50fe3f1d70924dc27"
    }
  ],
  "provenance": {
    "created_at": "2026-08-10",
    "generator": "nostr_automerge_conformance generate_signed_profile projection",
    "generator_revision": "signed_scenario_v2",
    "source_versions": {
      "nostr_automerge": "0.1.0-alpha.0"
    }
  },
  "requirements": [
    "NCRDT-CONF-002",
    "NCRDT-STATE-002"
  ],
  "revision": "draft_2026_08",
  "seed": null
}